{
  "check_count": 10,
  "checks": [
    {
      "actual": {
        "exists": true
      },
      "expected": {
        "exists": true
      },
      "id": "source_ledger_present",
      "passed": true,
      "summary": "source_ledger_present: passed=True"
    },
    {
      "actual": {
        "schema_version": "hfr.agentic_loop_ledger.v1"
      },
      "expected": {
        "schema_version": "hfr.agentic_loop_ledger.v1"
      },
      "id": "source_ledger_schema_version",
      "passed": true,
      "summary": "source_ledger_schema_version: passed=True"
    },
    {
      "actual": {
        "passed": true
      },
      "expected": {
        "passed": true
      },
      "id": "source_ledger_passed",
      "passed": true,
      "summary": "source_ledger_passed: passed=True"
    },
    {
      "actual": {
        "cloud_jobs_started": false,
        "credential_values_recorded": false,
        "ledger_only": true,
        "live_benchmarks_started": false,
        "model_downloads_started": false,
        "paid_model_grader_calls_started": false,
        "weights_updated_by_flight_recorder": false
      },
      "expected": {
        "cloud_jobs_started": false,
        "credential_values_recorded": false,
        "ledger_only": true,
        "live_benchmarks_started": false,
        "model_downloads_started": false,
        "paid_model_grader_calls_started": false,
        "weights_updated_by_flight_recorder": false
      },
      "id": "source_ledger_fail_closed",
      "passed": true,
      "summary": "source_ledger_fail_closed: passed=True"
    },
    {
      "actual": {
        "action": "approve"
      },
      "expected": {
        "actions": [
          "approve",
          "reject",
          "rollback",
          "request_another_iteration"
        ]
      },
      "id": "requested_action_known",
      "passed": true,
      "summary": "requested_action_known: passed=True"
    },
    {
      "actual": {
        "action": "approve",
        "listed": true
      },
      "expected": {
        "listed": true
      },
      "id": "requested_action_listed_by_ledger",
      "passed": true,
      "summary": "requested_action_listed_by_ledger: passed=True"
    },
    {
      "actual": {
        "action": "approve",
        "available": true,
        "blocked_reasons": []
      },
      "expected": {
        "available": true,
        "blocked_reasons": []
      },
      "id": "requested_action_available",
      "passed": true,
      "summary": "requested_action_available: passed=True"
    },
    {
      "actual": {
        "action": "approve",
        "execution_completion": "completed",
        "governance_readiness": "ready_for_review",
        "plan_readiness": "ready_to_execute",
        "ready_for_governance_review": true
      },
      "expected": {
        "action": "approve",
        "execution_completion": "completed",
        "governance_readiness": "ready_for_review",
        "plan_readiness": "ready_to_execute",
        "ready_for_governance_review": true
      },
      "id": "approval_requires_completed_governance_ready_execution",
      "passed": true,
      "summary": "approval_requires_completed_governance_ready_execution: passed=True"
    },
    {
      "actual": {
        "action": "approve",
        "cloud_training_completion_candidate_matches_loop": true,
        "cloud_training_completion_candidate_matches_training_result": true,
        "cloud_training_completion_candidate_model_id": "local/mock-candidate",
        "cloud_training_completion_claims_allowed": true,
        "cloud_training_completion_execution_id": "promotion-cloud-training-001",
        "cloud_training_completion_execution_status": "completed",
        "cloud_training_completion_execution_terminal": true,
        "cloud_training_completion_governance_readiness": "ready_for_review",
        "cloud_training_completion_integrity_passed": true,
        "cloud_training_completion_loop_candidate_model_id": "local/mock-candidate",
        "cloud_training_completion_output_artifact_count": 1,
        "cloud_training_completion_output_artifact_manifest_bound": true,
        "cloud_training_completion_output_artifact_set_bound": true,
        "cloud_training_completion_provider_id": "modal",
        "cloud_training_completion_provider_job_id": "promotion-modal-job-001",
        "cloud_training_completion_provider_matches_pipeline": true,
        "cloud_training_completion_source_bindings_complete": true,
        "cloud_training_completion_successful": true
      },
      "expected": {
        "action": "approve",
        "cloud_training_completion_candidate_matches_loop": true,
        "cloud_training_completion_candidate_matches_training_result": true,
        "cloud_training_completion_candidate_model_id": "<non-empty>",
        "cloud_training_completion_claims_allowed": true,
        "cloud_training_completion_execution_id": "<non-empty>",
        "cloud_training_completion_execution_status": "completed",
        "cloud_training_completion_execution_terminal": true,
        "cloud_training_completion_governance_readiness": "ready_for_review",
        "cloud_training_completion_integrity_passed": true,
        "cloud_training_completion_loop_candidate_model_id": "<non-empty>",
        "cloud_training_completion_output_artifact_count": 1,
        "cloud_training_completion_output_artifact_manifest_bound": true,
        "cloud_training_completion_output_artifact_set_bound": true,
        "cloud_training_completion_provider_id": "<non-empty>",
        "cloud_training_completion_provider_job_id": "<non-empty>",
        "cloud_training_completion_provider_matches_pipeline": true,
        "cloud_training_completion_source_bindings_complete": true,
        "cloud_training_completion_successful": true
      },
      "id": "approval_requires_successful_cloud_training_completion",
      "passed": true,
      "summary": "approval_requires_successful_cloud_training_completion: passed=True"
    },
    {
      "actual": {
        "cloud_jobs_started": false,
        "credential_values_recorded": false,
        "live_benchmarks_started": false,
        "model_downloads_started": false,
        "paid_model_grader_calls_started": false,
        "promotion_alias_moved": false,
        "receipt_only": true,
        "rollback_applied": false,
        "weights_updated_by_flight_recorder": false
      },
      "expected": {
        "cloud_jobs_started": false,
        "credential_values_recorded": false,
        "live_benchmarks_started": false,
        "model_downloads_started": false,
        "paid_model_grader_calls_started": false,
        "promotion_alias_moved": false,
        "receipt_only": true,
        "rollback_applied": false,
        "weights_updated_by_flight_recorder": false
      },
      "id": "flight_recorder_did_not_apply_governance_side_effects",
      "passed": true,
      "summary": "flight_recorder_did_not_apply_governance_side_effects: passed=True"
    }
  ],
  "created_at": "2026-07-03T00:00:00+00:00",
  "decision": {
    "blocking_check_count": 0,
    "blocking_checks": [],
    "latest_iteration_id": "demo-loop-001",
    "ledger_recommended_governance_action": "approve",
    "readiness": "ready",
    "recommendation": "record_approval_for_promotion_review",
    "selected_action": "approve",
    "summary": "Governance action approve recorded without applying side effects."
  },
  "execution_boundary": {
    "cloud_jobs_started": false,
    "credential_values_recorded": false,
    "live_benchmarks_started": false,
    "model_downloads_started": false,
    "paid_model_grader_calls_started": false,
    "promotion_alias_moved": false,
    "receipt_only": true,
    "rollback_applied": false,
    "weights_updated_by_flight_recorder": false
  },
  "failed_check_count": 0,
  "notes": [
    "This receipt records a governance choice over the latest agentic loop ledger; it does not move aliases, apply rollback, launch cloud jobs, or update weights.",
    "Approval only records readiness for promotion review. Promotion, rollback, alias movement, and release publication remain separate governed receipts."
  ],
  "passed": true,
  "readiness": "recorded",
  "receipt_path": "examples/agentic_training/loop_governance_receipt.json",
  "recommendation": "record_approval_for_promotion_review",
  "requested_action": {
    "action": "approve",
    "available": true,
    "blocked_reason_count": 0,
    "blocked_reasons": [],
    "reason": "Demo ledger is ready for promotion review; this approval receipt records review readiness without provider, benchmark, alias, or weight side effects.",
    "requested_by": "example-governance",
    "summary": "Approve the iteration for promotion review when readiness, promotion-decision, and promotion-ledger receipts are present."
  },
  "schema_version": "hfr.agentic_loop_governance_receipt.v1",
  "source_ledger": {
    "decision": {
      "governance_actions": [
        {
          "action": "approve",
          "available": true,
          "blocked_reason_count": 0,
          "blocked_reasons": [],
          "summary": "Approve the iteration for promotion review when readiness, promotion-decision, and promotion-ledger receipts are present."
        },
        {
          "action": "reject",
          "available": true,
          "blocked_reason_count": 0,
          "blocked_reasons": [],
          "summary": "Reject the iteration without moving aliases or weights."
        },
        {
          "action": "rollback",
          "available": true,
          "blocked_reason_count": 0,
          "blocked_reasons": [],
          "summary": "Rollback is available only when a rollback receipt is present in governance artifacts."
        },
        {
          "action": "request_another_iteration",
          "available": true,
          "blocked_reason_count": 0,
          "blocked_reasons": [],
          "summary": "Governance can request another iteration."
        }
      ],